{
  "$schema": "../schemas/app.schema.json",
  "id": "vscode",
  "name": "Visual Studio Code",
  "description": "Portable Visual Studio Code stable build.",
  "publisher": "Microsoft",
  "homepage": "https://code.visualstudio.com/",
  "category": "development",
  "architectures": ["x64"],
  "dependencies": [],
  "install": {
    "type": "zip",
    "url": "https://update.code.visualstudio.com/latest/win32-x64-archive/stable",
    "fileName": "VSCode-win32-x64.zip",
    "extractTo": "C:\\SandboxToolbox\\VSCode",
    "postInstall": [
      "New-Item -Path 'C:\\SandboxToolbox\\VSCode\\data' -ItemType Directory -Force | Out-Null"
    ]
  },
  "detection": {
    "type": "file",
    "value": "C:\\SandboxToolbox\\VSCode\\Code.exe"
  },
  "actions": [
    {
      "name": "Visual Studio Code",
      "type": "app",
      "path": "C:\\SandboxToolbox\\VSCode\\Code.exe"
    }
  ],
  "ui": { "recommended": true }
}
