{
  "$schema": "../schemas/app.schema.json",
  "id": "orca",
  "name": "Orca MSI Editor",
  "description": "MSI database table editor used for installer inspection and packaging.",
  "publisher": "Microsoft",
  "homepage": "https://learn.microsoft.com/windows/win32/msi/orca-exe",
  "category": "packaging",
  "architectures": ["x64"],
  "dependencies": [],
  "install": {
    "type": "zip",
    "url": "https://www.technipages.com/downloads/OrcaMSI.zip",
    "fileName": "OrcaMSI.zip",
    "extractTo": "C:\\SandboxToolbox\\Tools\\OrcaInstaller",
    "postInstall": [
      "$orcaMsi = Get-ChildItem -Path 'C:\\SandboxToolbox\\Tools\\OrcaInstaller' -Filter '*.msi' -Recurse -File | Select-Object -First 1; if (-not $orcaMsi) { throw 'No Orca MSI was found after extraction.' }; $p = Start-Process -FilePath 'msiexec.exe' -ArgumentList @('/i', $orcaMsi.FullName, '/qn', '/norestart') -Wait -PassThru; if ($p.ExitCode -notin @(0,3010)) { throw \"Orca MSI installer failed with exit code $($p.ExitCode).\" }"
    ]
  },
  "detection": {
    "type": "file",
    "value": "C:\\Program Files (x86)\\Orca\\Orca.exe"
  },
  "actions": [
    {
      "name": "Orca MSI Editor",
      "type": "app",
      "path": "C:\\Program Files (x86)\\Orca\\Orca.exe"
    }
  ],
  "ui": { "recommended": true }
}
